{
  "$schema": "https://json-schema.org/draft/2020-12/schema",
  "$id": "code-intel-sentrux-gate-policy.v1",
  "type": "object",
  "additionalProperties": false,
  "required": ["schema", "policyId", "policyVersion", "authority", "measurement", "advisoryRules", "blockingRules", "staticRules", "unknownSemantics"],
  "properties": {
    "schema": {"const": "code-intel-sentrux-gate-policy.v1"},
    "policyId": {"const": "evidence-quality-admission"},
    "policyVersion": {"const": 1},
    "authority": {"const": {"decisionRecord": "DR-0016", "approval": "https://github.com/2233admin/code-intel-pipeline/issues/427#issuecomment-6095655906"}},
    "measurement": {"$ref": "#/$defs/measurement"},
    "advisoryRules": {"const": ["quality_degraded"]},
    "blockingRules": {"const": ["coupling_increased", "cycles_increased", "god_files_increased", "baseline_missing", "baseline_engine_mismatch"]},
    "staticRules": {"const": "unchanged_blocking"},
    "unknownSemantics": {"const": "blocked"}
  },
  "$defs": {
    "identity": {
      "const": {"policyId": "evidence-quality-admission", "policyVersion": 1, "sha256": "f97cfed77d80be09acda1331bf449bb21e09ee58d91e19255313bbc5815d11f0"}
    },
    "measurement": {
      "const": {"baselineSchema": "code-intel-sentrux-baseline.v6", "engineId": "sentrux-native", "engineVersion": "3.0.0", "formulaVersion": "sentrux-upstream@6f8ff3c14b0423e4b58f42d1813d4d5f7fdc1d11+max-floor-0.01", "providerVersion": "code-intel-quality-signal.v1", "scope": ".", "fileGateSchema": "code-intel-file-gate.v1", "evidenceProfile": "directory-communities-file-loc-duplicate-only.v1"}
    }
  }
}
